,id,City,Address,lat,lon
2606,14497,San Antonio,"275, Natalen Street, Government Hill, San Antonio, Bexar County, Texas, 78209, USA",29.45616471,-98.46652313
2607,14502,Dallas,"5050, Haverwood Lane, Dallas, Collin County, Texas, 75287, USA",33.00592812,-96.81958041
2608,14504,Canyon,"Cleta, Randall County, Texas, 79015, USA",34.93903347,-101.9132641
2609,14505,Houston,"820, Jewett Street, North Inner Loop, Houston, Harris County, Texas, 77009, USA",29.79905902,-95.37493923
2610,14506,Surfside Beach,"1097, Sea Shell Drive, Surfside Beach, Brazoria County, Texas, 77541, USA",28.94155085,-95.29349087
2611,14507,Abilene,"Sayles Boulevard, Abilene, Taylor County, Texas, 79697, USA",32.44628723,-99.74742308
2612,14509,Euless,"12191, Atlantic Drive, Euless, Tarrant County, Texas, 76039, USA",32.85444914,-97.07657722
2613,14512,Galveston,"Saint Paul Church, 15th Street, Galveston, Galveston County, Texas, 77550, USA",29.30101349,-94.78244009
2614,14513,Dallas,"7421, Frankford Road, Dallas, Collin County, Texas, 78080, USA",32.99997074,-96.77599526
2615,14514,Bastrop,"215, Riverwood Drive, Riverside Grove, Bastrop, Bastrop County, Texas, 78602, USA",30.12249095,-97.33766583
2616,14516,Fort Worth,"1801, High Vista Court, Fort Worth, Tarrant County, Texas, 76112, USA",32.75325172,-97.18685468
2617,14518,Corpus Christi,"Smith Elementary School, Williams Drive, South Side, Corpus Christi, Nueces County, Texas, 78412, USA",27.69170638,-97.3461816
2618,14519,Austin,"Community First Village, Hog Eye Road, The Woodlands, Travis County, Texas, 78724, USA",30.28188109,-97.62328007
2619,14520,Allen,"412, Irvine Drive, Watters Creek, Allen, Collin County, Texas, 75013, USA",33.09533497,-96.70009475
2620,14521,Quitman,"1413, County Road 1226, Wood County, Texas, 75783, USA",32.85482036,-95.51155842
2621,14522,Corpus Christi,"14833, Windward Drive, Mustang-Padre Island, Corpus Christi, Nueces County, Texas, 78418, USA",27.60742383,-97.20883855
2622,14523,Surfside Beach,"Sam's Alley, Surfside Beach, Brazoria County, Texas, USA",28.9603031,-95.27627975
2623,14524,Denton,"North Bonnie Brae Street, Denton, Denton County, Texas, 76201, USA",33.22257982,-97.16197561
2624,14525,Houston,"7420, Brompton Road, Brompton Court, Houston, Harris County, Texas, 77025, USA",29.69993526,-95.42321794
2625,14526,Denton,"3045, Weston Drive, Denton, Denton County, Texas, 76209, USA",33.21989289,-97.09816456
2626,14527,Euless,"East Ash Lane, Euless, Tarrant County, Texas, 76039, USA",32.85989698,-97.07205181
2627,14528,Dallas,"11409, North Central Expressway, Dallas, Dallas County, Texas, 75243, USA",32.90453471,-96.77035997
2628,14529,Seabrook,"TX 146, Clear Lake Shores, Galveston County, Texas, 77565, USA",29.5493464,-95.02347468
2629,14530,Fort Worth,"3709, Lawndale Avenue, Fort Worth, Tarrant County, Texas, 76133, USA",32.65640274,-97.37135822
2630,14531,McKinney,"North College Street, McKinney, Collin County, Texas, 75069, USA",33.2088999,-96.62027939
2631,14532,San Antonio,"818, Blanco Road, Beacon Hill, San Antonio, Bexar County, Texas, 78212, USA",29.45312783,-98.50780949
2632,14533,Sunset Valley,"34, Lone Oak Trail, Sunset Oaks, Sunset Valley, Travis County, Texas, TX 78745, USA",30.22288788,-97.81354888
2633,14534,Fort Worth,"1801, Crooked Lane, Fort Worth, Tarrant County, Texas, 76112, USA",32.75322804,-97.18472359
2634,14535,Fort Worth,"6945, Valhalla Road, Fort Worth, Tarrant County, Texas, 76116, USA",32.70349556,-97.43390055
2635,14536,Bandera,"Lacey Drive, Bandera County, Texas, 78003, USA",29.75801098,-99.06946486
2636,14537,Corpus Christi,"14846, Granada Drive, Mustang-Padre Island, Corpus Christi, Nueces County, Texas, 78418, USA",27.61057635,-97.21195658
2637,14538,Killeen,"3401, Lagrone Court, Killeen, Bell County, Texas, 76542, USA",31.07722655,-97.72030861
2638,14539,Dallas,"7225, Fair Oaks Avenue, Vickery Meadows PID, Dallas, Dallas County, Texas, 75231, USA",32.87612749,-96.757391
2639,14540,Houston,"1600, Holly Street, North Inner Loop, Houston, Harris County, Texas, 77007, USA",29.77245248,-95.36844407
2640,14544,Fort Worth,"River Crest Country Club, Alta Drive, Fort Worth, Tarrant County, Texas, 76107, USA",32.74507524,-97.38201442
2641,14545,Corpus Christi,"14274, Allamanda Drive, Mustang-Padre Island, Corpus Christi, Kleberg County, Texas, 78418, USA",27.58021191,-97.23189346
2642,14546,Dallas,"5203, Alpha Road, Farmers Branch, Dallas County, Texas, 75240, USA",32.93403106,-96.8196459
2643,14547,Houston,"1418, West 23rd Street, North Inner Loop, Houston, Harris County, Texas, 77008, USA",29.80644488,-95.42441753
2644,14550,Dallas,"Oak Lawn Avenue, Oak Lawn-Hi Line PID, Dallas, Dallas County, Texas, 75219, USA",32.7961745,-96.82052135
2645,14551,Houston,"Amegy Bank, 2303, West Holcombe Boulevard, Houston, Harris County, Texas, 77030, USA",29.70582318,-95.41364837
2646,14552,Ben Wheeler,"401, VZ County Road 4410, Ben Wheeler, Van Zandt County, Texas, 75754, USA",32.44611612,-95.7361117
2647,14553,Fort Worth,"1454, Arbor Ridge Drive, Fort Worth, Tarrant County, Texas, 76112, USA",32.75749906,-97.19022997
2648,14554,Austin,"Del Valle High School, 5201, Ross Road, Berdoll Farms, Moores Crossing, Travis County, Texas, 78617, USA",30.17734896,-97.61649427
2649,14555,San Antonio,"11820, Sandman Street, San Antonio, Bexar County, Texas, 78216, USA",29.54861858,-98.49946951
2650,14556,Houston,"648, Delz Street, Houston, Harris County, Texas, 77018, USA",29.83955741,-95.40976961
2651,14557,Dallas,"8850, Ferguson Road, Dallas, Dallas County, Texas, 75218:75228, USA",32.81237358,-96.69729445
2652,14561,McKinney,"5105, Blackwood Drive, McKinney, Collin County, Texas, 75071, USA",33.2375403,-96.6834242
2653,14562,Dallas,"615, Blanning Drive, Dallas, Dallas County, Texas, 75218, USA",32.85186561,-96.70685684
2654,14563,Richmond,"Cunchola Lane, Crabb, Fort Bend County, Texas, USA",29.53261006,-95.72047906
2655,14564,Beaumont,"501, Hooks Avenue, Beaumont, Jefferson County, Texas, 77706, USA",30.0858416,-94.15362611
2656,14565,Hurst,"Hickory Court, Hurst, Tarrant County, Texas, 76054, USA",32.85697611,-97.1809346
2657,14566,Arlington,"6141, Meadowside Trail, Arlington, Tarrant County, Texas, 76017, USA",32.64731111,-97.1201481
2658,14567,Bedford,"3873, Walnut Drive, Bedford, Tarrant County, Texas, 76021, USA",32.84766672,-97.10518225
2659,14568,Denton,"2127, Northwood Terrace, Denton, Denton County, Texas, 76209, USA",33.23453004,-97.12072589
2660,14569,Richmond,"Driscoll Park Drive, Lakemont West Ridge, Fort Bend County, Texas, 77407, USA",29.68129351,-95.74992887
2661,14570,Austin,"505, West Alpine Road, Dawson, Austin, Travis County, Texas, 78704, USA",30.22995645,-97.76584562
2662,14571,Fort Worth,"3917, Eldridge Street, Fort Worth, Tarrant County, Texas, 76107, USA",32.7218691,-97.39308474
2663,14572,Dallas,"505, West 10th Street, Bishop Arts District, Dallas, Dallas County, Texas, 75208, USA",32.74551768,-96.83072974
2664,14573,Rosenberg,"5250, Stoneridge Court, The Oaks of Rosenberg, Rosenberg, Fort Bend County, Texas, 77471, USA",29.53138186,-95.7660852
2665,14574,Austin,"4020, Manchaca Road, South Lamar, Austin, Travis County, Texas, 78748, USA",30.23271313,-97.78685118
2666,14575,Denton,"Visual Arts Building, Oakland Street, Denton, Denton County, Texas, 76201, USA",33.22216578,-97.13021308
2667,14576,McKinney,"Del Rey Avenue, McKinney, Collin County, Texas, 75070, USA",33.15558053,-96.70188777
2668,14577,Palestine,"Bradford, Anderson County, Texas, USA",32.02216508,-95.75995159
2669,14578,San Antonio,"136, East Kings Highway, Monte Vista, San Antonio, Bexar County, Texas, 78212, USA",29.45943475,-98.49311884
2670,14579,Grapevine,"168, West Hall Street, Grapevine, Tarrant County, Texas, 76051, USA",32.94528988,-97.07848712
2671,14580,Kemah,"724, Bay Avenue, Kemah, Galveston County, Texas, 77565, USA",29.54256563,-95.01678023
2672,14582,Houston,"227, North Delano Street, Houston, Harris County, Texas, 77003, USA",29.75665542,-95.3421511
2673,14583,Houston,"226, Cavalcade Street, Houston, Harris County, Texas, 77026, USA",29.80337394,-95.36961056
2674,14584,Manor,"16909, Hamilton Point Circle, Manor, Travis County, Texas, 78653, USA",30.33548266,-97.55055038
2675,14585,League City,"542, Auburn Creek Lane, The Lakes at South Shore Harbor, League City, Galveston County, Texas, 77573, USA",29.51501703,-95.04605791
2676,14586,Euless,"607, Creekside Drive, Euless, Tarrant County, Texas, 76040, USA",32.828658,-97.07634499
2677,14587,Mabank,"Boyce Drive, Gun Barrel City, Henderson County, Texas, 75156, USA",32.30603389,-96.12979106
2678,14589,Dallas,"14120, Noel Road, Dallas, Dallas County, Texas, 75254, USA",32.94093767,-96.81764577
2679,14590,League City,"East Red Adair Boulevard, League City, Galveston County, Texas, 77565, USA",29.54533154,-95.06483378
2680,14591,Dallas,"2315, Moser Avenue, Lower Greenville, Dallas, Dallas County, Texas, 75206, USA",32.81354261,-96.77891468
2681,14592,Bellaire,"4905, Elm Street, Bellaire, Harris County, Texas, 77401, USA",29.71262016,-95.46511329
2682,14593,Fort Worth,"5760, Gleneagles Circle, Fort Worth, Tarrant County, Texas, 76137, USA",32.85147275,-97.29631918
2683,14594,Sugar Land,"7050, Dunbarton Drive, Telfair, Sugar Land, Fort Bend County, Texas, 77479, USA",29.59065864,-95.65398789
2684,14595,Bandera,"Bandera County, Texas, 78803, USA",29.69289853,-99.06386312
2685,14596,San Leon,"1465, 10th Street, San Leon, Galveston County, Texas, 77539, USA",29.47339165,-94.92629956
2686,14597,Corpus Christi,"Boat House, Windward Drive, Mustang-Padre Island, Corpus Christi, Nueces County, Texas, USA",27.60312492,-97.21378602
2687,14598,Amarillo,"1368, Southwest 22nd Avenue, Bivins Addition, Amarillo, Potter County, Texas, 79109, USA",35.18924521,-101.8529322
2688,14599,Denton,"3851, Willowick Circle, Denton, Denton County, Texas, 76210, USA",33.16505666,-97.10379807
2689,14600,Dallas,"733, Texas Street, Deep Ellum PID, Dallas, Dallas County, Texas, 75204, USA",32.78930842,-96.78914904
2690,14601,League City,"League City, Galveston County, Texas, 77565, USA",29.5415794,-95.05753509
2691,14602,San Antonio,"1649, West Magnolia Avenue, Fulton, San Antonio, Bexar County, Texas, 78201, USA",29.45590144,-98.52242947
2692,14603,Irving,"3890, Double Oak Lane, Irving, Dallas County, Texas, 75061, USA",32.82741743,-97.00272121
2693,14605,Fort Worth,"3536, Ramona Drive, Fort Worth, Tarrant County, Texas, 76116, USA",32.72013655,-97.44514523
2694,14606,San Antonio,"228, College Boulevard, Alamo Heights, Bexar County, Texas, 78209, USA",29.48684773,-98.46875027
2695,14608,Crystal Beach,"2622, Tide Road, Bolivar Peninsula, Galveston County, Texas, 77650, USA",29.46589005,-94.60722284
2696,14610,McKinney,"739, Glenwood Court, McKinney, Collin County, Texas, 75071, USA",33.20577977,-96.65690263
2697,14611,Houston,"4099, Greeley Street, Houston, Harris County, Texas, 77006, USA",29.73668466,-95.38817844
2698,14612,Austin,"Imperial Valley, Travis County, Texas, 78724, USA",30.28144366,-97.62198921
2699,14613,Austin,"5200, Blue Bluff Road, Austin, Travis County, Texas, 78724, USA",30.26826319,-97.61866393
2700,14615,Houston,"Macedonia Missionary Baptist Church, Wilson Street, Houston, Harris County, Texas, 77019, USA",29.75521217,-95.38133653
2701,14616,Fort Worth,"3716, Lafayette Avenue, Fort Worth, Tarrant County, Texas, 76107, USA",32.74179731,-97.37309877
2702,14617,Houston,"Baron, Houston, Harris County, Texas, 77020, USA",29.76612676,-95.33472957
2703,14618,Allen,"1207, Edgewood Lane, Watters Creek, Allen, Collin County, Texas, 75013, USA",33.10440471,-96.69512082
2704,14619,McKinney,"476, South Rice Street, McKinney, Collin County, Texas, 75069, USA",33.19409158,-96.62000575
2705,14620,San Antonio,"Keystone School, East Woodlawn Avenue, Monte Vista, San Antonio, Bexar County, Texas, 78212, USA",29.45255309,-98.49231296
2706,14621,Dallas,"10830, Stone Canyon Road, Dallas, Dallas County, Texas, 75230, USA",32.89390327,-96.7729625
2707,14622,Bay City,"Avenue F, Bay City, Matagorda County, Texas, 77414, USA",29.0143211,-95.97360451
2708,14623,Corpus Christi,"Bonasse Court, Mustang-Padre Island, Corpus Christi, Nueces County, Texas, 78418, USA",27.60110878,-97.24815335
2709,14624,Bandera,"298, Blue Bonnet Drive, Bandera County, Texas, 78003, USA",29.75312338,-99.0766933
2710,14625,Arlington,"1671, East Lamar Boulevard, Arlington, Tarrant County, Texas, 76011, USA",32.76315476,-97.08664084
2711,14629,Arlington,"635, Waggoner Drive, Arlington, Tarrant County, Texas, 76013, USA",32.72803363,-97.14052401
2712,14630,Galveston,"1038, Lakewood Drive, Stingaree, Galveston County, Texas, 77650, USA",29.46150663,-94.63426456
2713,14631,Denton,"736, Cordell Street, Denton, Denton County, Texas, 76201, USA",33.22664346,-97.13935909
2714,14632,Sugar Land,"2568, Grants Lake Boulevard, Sugar Land, Fort Bend County, Texas, 77479, USA",29.59107458,-95.61421472
2715,14633,Dallas,"14308, Hidden Springs Court, Dallas, Dallas County, Texas, 75254, USA",32.94398798,-96.81258972
2716,14634,Fort Worth,"3637, Harley Avenue, Fort Worth, Tarrant County, Texas, 76107, USA",32.74213177,-97.37163208
2717,14636,Houston,"Westpark Tollway, Sedona, Cinco Ranch, Fort Bend County, Texas, 77441, USA",29.69938057,-95.78605448
2718,14637,Corpus Christi,"Mustang-Padre Island, Corpus Christi, Nueces County, Texas, 78418, USA",27.62699926,-97.23407835
2719,14638,Houston,"8043, Zimmermann Drive, Near Northwest, Houston, Harris County, Texas, 77088, USA",29.88384141,-95.48047558
2720,14639,Sugar Land,"Regal Falls Couer, Sugar Land, Fort Bend County, Texas, 77479, USA",29.56917309,-95.6760468
2721,14640,Dallas,"4381, Laguna Drive, Dallas, Collin County, Texas, 75287, USA",33.00540478,-96.83485369
2722,14641,Canton,"Farm-to-Market Road 1651, Whitton, Van Zandt County, Texas, USA",32.4774535,-95.92590244
2723,14642,Corpus Christi,"Boat House, Windward Drive, Mustang-Padre Island, Corpus Christi, Nueces County, Texas, USA",27.6029157,-97.21393381
2724,14643,Bandera,"Live Oak Ridge, Bandera County, Texas, USA",29.78972413,-99.0405282
2725,14644,Houston,"3842, Deer Grass Court, Houston, Harris County, Texas, 77059, USA",29.60364876,-95.11799139
2726,14645,Seabrook,"972, Todville Road, Seabrook, Harris County, Texas, 77586, USA",29.5559496,-95.01833979
2727,14646,Corpus Christi,"14971, Granada Drive, Mustang-Padre Island, Corpus Christi, Nueces County, Texas, 78418, USA",27.60925185,-97.2105627
2728,14647,Corpus Christi,"6098, Cindia Street, Corpus Christi, Nueces County, Texas, 78415, USA",27.71874991,-97.43460825
2729,14648,Dallas,"11339, Park Central Place, Dallas, Dallas County, Texas, 75230, USA",32.90449647,-96.77151712
2730,14649,Humble,"5486, Heronwood Drive, The North of Atascocita, Kingwood Glen, Harris County, Texas, 77346, USA",30.01271466,-95.19130194
2731,14650,Dallas,"7421, Frankford Road, Dallas, Collin County, Texas, 75252, USA",33.00149118,-96.77737052
2732,14651,Fort Worth,"7124, Fire Hill Drive, Fort Worth, Tarrant County, Texas, 76137, USA",32.86817041,-97.2814102
2733,14652,Houston,"14576, Hampton Green Lane, Harris County, Texas, 77044, USA",29.92420589,-95.16786057
2734,14653,Austin,"2928, Long Day Drive, Pioneer Crossing East, Austin, Travis County, Texas, 78754, USA",30.36335047,-97.64423384
2735,14654,Dallas,"19211, Preston Road, Dallas, Collin County, Texas, 75252, USA",33.00907415,-96.79732054
2736,14655,League City,"League City, Galveston County, Texas, 77573, USA",29.49364061,-95.09680127
2737,14656,Austin,"Wells Fargo, 501, South Congress Avenue, Auditorium Shores, Austin, Travis County, Texas, 78704, USA",30.25632932,-97.74645531
2738,14657,San Antonio,"Trail Street, Monte Vista, San Antonio, Bexar County, Texas, 78212, USA",29.45532961,-98.48755649
2739,14658,Irving,"Woodland Ridge Apartments, Irving, Dallas County, Texas, USA",32.8588549,-96.99748919
2740,14659,Dallas,"4203, Briarbend Road, Dallas, Collin County, Texas, 75287, USA",33.00599356,-96.83894759
2741,14660,Dallas,"President George Bush Turnpike, Dallas, Collin County, Texas, 75252, USA",33.0125817,-96.80819799
2742,14661,Galveston,"Miller's Seawall Restaurant, 19th Street, Galveston, Galveston County, Texas, 77550, USA",29.29349685,-94.78473296
2743,14662,Port Aransas,"200, Church Street, Port Aransas, Aransas County, Texas, 78373, USA",27.8326377,-97.06107032
2744,14664,Corpus Christi,"Running Light, Mustang-Padre Island, Corpus Christi, Nueces County, Texas, USA",27.60724447,-97.21351771
2745,14665,Fort Worth,"4218, Birchman Avenue, Fort Worth, Tarrant County, Texas, 76107, USA",32.73492685,-97.38132232
2746,14666,Bastrop,"157, Redd Road, Riverside Grove, Bastrop, Bastrop County, Texas, 78602, USA",30.12326481,-97.33991202
2747,14667,Dallas,"5743, Morningside Avenue, Lower Greenville, Dallas, Dallas County, Texas, 75206, USA",32.82938555,-96.76840106
2748,14669,Fort Worth,"9136, Steiner Street, Fort Worth, Tarrant County, Texas, 76244, USA",32.90630989,-97.28107976
2749,14670,Galveston,"1705, 18th Street, Galveston, Galveston County, Texas, 77550, USA",29.29496663,-94.78419992
2750,14671,Houston,"2216, Lamar Street, Houston, Harris County, Texas, 77003, USA",29.74980197,-95.35505056
2751,14672,Wharton,"308, Davis Street, Wharton, Wharton County, Texas, 77488, USA",29.31179199,-96.09676289
2752,14673,Dallas,"855, Farmers Market Way, West End Historic District, Downtown PID, Dallas, Dallas County, Texas, 75201, USA",32.77856572,-96.78655237
2753,14674,Dallas,"6283, La Vista Drive, Lower Greenville, Dallas, Dallas County, Texas, 75214, USA",32.81262311,-96.75585845
2754,14675,Dallas,"Lyndon B Johnson Freeway, Dallas, Dallas County, Texas, 75244, USA",32.92562079,-96.82242523
2755,14676,Dallas,"The Mansion on Turtle Creek, Gillespie Street, Oak Lawn, Dallas, Dallas County, Texas, 75219, USA",32.80381867,-96.80663795
2756,14677,Houston,"1287, Jefferson Street, Houston, Harris County, Texas, 77002, USA",29.74962172,-95.36718169
2757,14678,Humble,"Page Forest Drive, Claytons Corner, Kingwood Glen, Harris County, Texas, 77338:77346, USA",29.98657514,-95.19568602
2758,14679,Humble,"9498, Greencape Court, Dyersdale, Harris County, Texas, 77396, USA",29.92953838,-95.25096238
2759,14680,Euless,"2082, North Main Street, Euless, Tarrant County, Texas, 76039, USA",32.86714459,-97.08255888
2760,14681,Tiki Island,"1237, Tiki Drive, Tiki Island, Galveston County, Texas, 77554, USA",29.29691344,-94.9135961
2761,14682,McKinney,"8152, Shasta Drive, McKinney, Collin County, Texas, 75071, USA",33.2071562,-96.72385328
2762,14683,Rockport,"Lago Vista Drive, Rockport, Aransas County, Texas, 78382, USA",28.0651287,-97.07670385
2763,14684,Fort Worth,"Northwest High School, 2301, Texan Drive, Fort Worth, Denton County, Texas, 76247, USA",33.02868108,-97.31199284
2764,14685,Corpus Christi,"15400, Gun Cay Court, Mustang-Padre Island, Corpus Christi, Nueces County, Texas, 78418, USA",27.5981063,-97.23357187
2765,14686,Frisco,"8479, Biscayne Street, Frisco, Collin County, Texas, 75035, USA",33.14906094,-96.77288532
2766,14687,Houston,"8534, Findlay Street, Houston, Harris County, Texas, 77017, USA",29.69065169,-95.26650747
2767,14688,Houston,"1080, Alabama Street, Houston, Harris County, Texas, 77004, USA",29.7375264,-95.37937803
2768,14689,Dallas,"Thanksgiving Chapel, North Ervay Street, West End Historic District, Downtown PID, Dallas, Dallas County, Texas, 75201, USA",32.78266918,-96.79838739
2769,14690,Denton,"1427, Auburn Drive, Denton, Denton County, Texas, 76201, USA",33.23598486,-97.14997407
2770,14691,Anson,"Anson, Jones County, Texas, 79525, USA",32.70836419,-99.87875138
2771,14692,Sugar Land,"5583, Waverdale Court, New Territory, Fort Bend County, Texas, 77479, USA",29.59373813,-95.68177648
2772,14695,Galveston,"Bayou Circle, Galveston, Galveston County, Texas, 77551, USA",29.28794838,-94.83351819
2773,14696,Dallas,"7512, Campbell Road, Richardson, Dallas County, Texas, 78080, USA",32.97784793,-96.77084142
2774,14697,University Park,"6403, East Northwest Parkway North, Dallas, Dallas County, Texas, 75225, USA",32.86603077,-96.79693611
2775,14698,Austin,"4511, Avenue D, Hyde Park, Austin, Travis County, Texas, 78751, USA",30.3097419,-97.72852015
2776,14699,Corinth,"1892, Morning Glory Drive, Corinth, Denton County, Texas, 76210, USA",33.14505778,-97.08167652
2777,14700,Dallas,"9110, Westglen Drive, Dallas, Dallas County, Texas, 75228, USA",32.81525493,-96.69798771
2778,14701,Houston,"Sterling Inn and Suites at Reliant and Medical Center Houston, South Loop East Frontage Road, Houston, Harris County, Texas, 77025-9998, USA",29.67807222,-95.41647711
2779,14702,Corpus Christi,"Whataburger, 14301, South Padre Island Drive, Mustang-Padre Island, Corpus Christi, Nueces County, Texas, 78418, USA",27.62309464,-97.22186519
2780,14703,McKinney,"1000, Margaret Drive, McKinney, Collin County, Texas, 75071, USA",33.20798793,-96.64201676
2781,14704,McKinney,"4999, Monte Vista Lane, McKinney, Collin County, Texas, 75070, USA",33.16168375,-96.67923244
2782,14705,Bastrop,"Goodman, Bastrop County, Texas, USA",30.15364205,-97.37218293
2783,14707,Euless,"1145, Marshall Drive, Euless, Tarrant County, Texas, 76039, USA",32.85313382,-97.08080788
2784,14708,McKinney,"290, Clara Avenue, McKinney, Collin County, Texas, 75069, USA",33.18443339,-96.61577416
2785,14709,Fort Worth,"4720, Driskell Boulevard, Fort Worth, Tarrant County, Texas, 76107, USA",32.719383,-97.38984283
2786,14710,Dallas,"9262, Forest Lane, Lake Highlands, Dallas, Dallas County, Texas, 75243, USA",32.909001,-96.74067925
2787,14711,Grapevine,"NTB, Access Road, Grapevine, Tarrant County, Texas, 76051, USA",32.92117022,-97.07742664
2788,14712,Katy,"Roesner Road, Westlake, Fort Bend County, Texas, 77494, USA",29.74192424,-95.81440773
2789,14714,Port Aransas,"1459, Whispering Sands Street, Port Aransas, Aransas County, Texas, 78373, USA",27.82013218,-97.06856969
2790,14715,Austin,"11801 1/2, Farmhaven Road, Harris Branch, Austin, Travis County, Texas, 78653, USA",30.35271997,-97.60855138
2791,14716,McKinney,"2598, Barranca Way, McKinney, Collin County, Texas, 75069, USA",33.1766642,-96.629996
2792,14717,Hurst,"2229, Cambridge Drive, Hurst, Tarrant County, Texas, 76054, USA",32.85747876,-97.17631294
2793,14718,San Antonio,"598, Brackenridge Avenue, Government Hill, San Antonio, Bexar County, Texas, 78209, USA",29.45155594,-98.46609381
2794,14719,Corpus Christi,"3980, Marlin Drive, Flour Bluff, Corpus Christi, Nueces County, Texas, 78418, USA",27.6167896,-97.29903691
2795,14721,Corpus Christi,"15000, Windward Drive, Mustang-Padre Island, Corpus Christi, Nueces County, Texas, 78418, USA",27.6026829,-97.21045469
2796,14722,Frisco,"10060, Bowling Green Drive, Frisco, Collin County, Texas, 75035, USA",33.17869324,-96.79308094
2797,14723,Dallas,"2100, Olive Street, Kyle Warren Park-Arts District PID, Dallas, Dallas County, Texas, 75201, USA",32.79173928,-96.80176536
2798,14724,Rockport,"Moline, Rockport, Aransas County, Texas, 78382, USA",28.03706225,-97.05853991
2799,14725,Fulton,"North 2nd Street, Fulton, Aransas County, Texas, 78358, USA",28.06615988,-97.03586722
2800,14726,Irving,"Marble Tree Apartments, Irving, Dallas County, Texas, 75038, USA",32.86387721,-96.99700421
2801,14727,Sweeny,"6834, FM 1459, Sweeny, Brazoria County, Texas, 77480, USA",29.09530308,-95.68998301
2802,14728,Grapevine,"234, East College Street, Grapevine, Tarrant County, Texas, 76051, USA",32.93551131,-97.07678411
2803,14729,Sargent,"Oak Circle, Sargent, Matagorda County, Texas, 77404, USA",28.79987399,-95.65674196
2804,14730,Abilene,"1479, Marsalis Drive, Abilene, Taylor County, Texas, 79603, USA",32.46745291,-99.77052448
2805,14731,Del Valle,"13413, Coomes Drive, Berdoll Farms, Austin, Travis County, Texas, 78617, USA",30.17058016,-97.61242833
2806,14732,Corpus Christi,"14977, Leeward Drive, Mustang-Padre Island, Corpus Christi, Nueces County, Texas, 78418, USA",27.60854172,-97.20924403
2807,14733,Dallas,"3235, Vann Court, Dallas, Dallas County, Texas, 75204, USA",32.79458853,-96.78955812
2808,14734,Berryville,"11345, Lakeview Mobile Road, Berryville, Henderson County, Texas, 75763, USA",32.08987315,-95.47192001
2809,14735,Dallas,"10588, Stone Canyon Road, Dallas, Dallas County, Texas, 75230, USA",32.89098851,-96.77433121
2810,14737,Dallas,"514, Marshalldell Avenue, Dallas, Dallas County, Texas, 75211, USA",32.74071863,-96.87210037
2811,14739,Sugarland,"Grand Parkway, Sandy Point, Fort Bend County, Texas, 77511, USA",29.51821978,-95.69983268
2812,14740,Rockport,"Copano Ridge Road, Copano Village, Aransas County, Texas, 78382, USA",28.07339546,-97.10670069
2813,14741,McKinney,"525, West Lamar Street, McKinney, Collin County, Texas, 75069, USA",33.20053336,-96.61970746
2814,14742,Corpus Christi,"15754, Cuttysark Street, Mustang-Padre Island, Corpus Christi, Nueces County, Texas, 78418, USA",27.59063136,-97.22672034
2815,14743,Houston,"Nassau Bay, Harris County, Texas, 77058, USA",29.54706887,-95.09048261
2816,14744,Fort Worth,"325, Windy Hill Lane, Fort Worth, Tarrant County, Texas, 76108, USA",32.76222424,-97.49061336
2817,14745,Baytown,"1908, North Main Street, Baytown, Harris County, Texas, 77520, USA",29.74584661,-94.96355953
2818,14746,San Antonio,"256, Sir Arthur Court, Castle Hills, Bexar County, Texas, 78213, USA",29.51649918,-98.51193269
2819,14747,Tool,"1671, TX 274, Tool, Henderson County, Texas, 75143, USA",32.26659989,-96.16936768
2820,14748,Corpus Christi,"14449, , Mustang-Padre Island, Corpus Christi, Nueces County, Texas, 78418, USA",27.62010725,-97.22224961
2821,14749,Bandera,"421, Highland Drive, Highland Waters, Bandera County, Texas, 78003, USA",29.74448278,-99.14303785
2822,14750,McKinney,"653, North Wood Street, McKinney, Collin County, Texas, 75069, USA",33.20360252,-96.61677853
