,id,City,Address,lat,lon
1,4,Bryan,"775, Inwood Drive, Bryan, Brazos County, Texas, 77802, USA",30.63730428,-96.33784597
2,6,Conroe,"9163, Red Stag, Montgomery County, Texas, 77303, USA",30.3704552,-95.38531904
3,8,Fort Worth,"4974, Glen Eden Drive, Fort Worth, Tarrant County, Texas, 76115, USA",32.68961141,-97.29816086
4,9,Rockport,"North Fulton Beach Road, Copano Village, Aransas County, Texas, 78358, USA",28.10372572,-97.02583209
5,11,Irving,"3841, Cheyenne Street, Irving, Dallas County, Texas, 75038, USA",32.86211601,-97.00264291
6,13,Round Mountain,"Nicholson Bluff Cv, Travis County, Texas, USA",30.35200485,-98.14624215
7,15,Kerrville,"699, Methodist Encampment Road, Kerrville, Kerr County, Texas, 78028, USA",30.07366703,-99.16136522
8,17,Austin,"F T and Belle Ramsey House, Avenue B, Hyde Park, Austin, Travis County, Texas, 78751, USA",30.309522,-97.73171047
9,18,Port Aransas,"800, Sandcastle Drive, Port Aransas, Aransas County, Texas, 78373, USA",27.81717552,-97.06809015
10,19,Houston,"13009, Sweetgum Shores Drive, Harmaston, Harris County, Texas, 77044, USA",29.95468009,-95.17607029
11,20,Frisco,"12363, Redbud Lane, Denton County, Texas, 75034, USA",33.15577622,-96.9304385
12,24,Katy,"James and Sharon Tays Junior High, 26721, Hawks Prairie Boulevard, Silver Ranch, Fort Bend County, Texas, 77494, USA",29.74070352,-95.82587851
13,25,Denton,"Nirvana Smoke Shop, 215, North Carroll Boulevard, Denton, Denton County, Texas, 76201, USA",33.21614026,-97.13775675
14,27,Richmond,"17498, Aspen Ridge Court, Twin Oaks Village, Fort Bend County, Texas, 77407, USA",29.69552664,-95.69011086
15,29,Austin,"2414, Kinney Road, Zilker, Austin, Travis County, Texas, 78704, USA",30.24429616,-97.77446858
16,31,Plano,"7951, Whispering Tree Lane, Plano, Collin County, Texas, 75024, USA",33.08495329,-96.78346949
17,32,Houston,"984, Villa de Matel Road, Houston, Harris County, Texas, 77023, USA",29.729391,-95.31251441
18,33,Arlington,"2244, Mediterranean Avenue, Arlington, Tarrant County, Texas, 76011, USA",32.77038954,-97.09001198
19,34,Austin,"2100, Rockmoor Avenue, The Doke, Austin, Travis County, Texas, 78703, USA",30.30038194,-97.77885789
20,35,Breckenridge,"Stephens County, Texas, USA",32.79998006,-98.84432664
21,36,Houston,"21733, Rio Villa Drive, Highlands, Harris County, Texas, 77049, USA",29.82627834,-95.07823934
22,37,Spicewood,"3721, Outback Trail, Travis County, Texas, 78669, USA",30.3877095,-98.09081262
23,38,Austin,"1603, Poquito Street, East Austin, Austin, Travis County, Texas, 78702, USA",30.27752338,-97.71919076
24,39,Fort Worth,"Wedgewood Nursing Home, 6621, Dan Danciger Road, Fort Worth, Tarrant County, Texas, 76133, USA",32.64994648,-97.4059862
25,40,Dallas,"Penuel Seventh Day Adventist Church, Bernal Drive, Dallas, Dallas County, Texas, 75212, USA",32.78663646,-96.87466869
26,41,Killeen,"4475, Menard Drive, Killeen, Bell County, Texas, 76549, USA",31.08831396,-97.77755412
27,42,New Braunfels,"448, Napoleon Street, New Braunfels, Comal County, Texas, 78130, USA",29.70471393,-98.12010313
28,43,Abilene,"South Leggett Drive, Abilene, Taylor County, Texas, 79605, USA",32.43616081,-99.77400979
29,44,Houston,"6994, Marisol Drive, Harris County, Texas, 77083, USA",29.70389701,-95.66395341
30,45,Abilene,"1351, Squires Road, Abilene, Taylor County, Texas, 79602, USA",32.43781002,-99.69983992
31,46,Austin,"14511, Deaf Smith Boulevard, Chaparral Crossing, Hornsby Bend, Travis County, Texas, 78725, USA",30.23294081,-97.58937812
32,47,Fort Worth,"1012, Garvey Street, Fort Worth, Tarrant County, Texas, 76102, USA",32.76650721,-97.32873671
33,48,Marble Falls,"WorldMark Marble Falls, Rocky Road, Marble Falls, Burnet County, Texas, 76654, USA",30.55111868,-98.28646131
34,49,Pasadena,"4381, Winterborne Drive, Village Grove, Pasadena, Harris County, Texas, 77505, USA",29.64732251,-95.13905355
35,50,College Station,"887, Marion Pugh Drive, Callaway Villas, College Station, Brazos County, Texas, 77840, USA",30.5976927,-96.33721105
36,51,San Antonio,"Connally Loop, San Antonio, Bexar County, Texas, 78217, USA",29.51605277,-98.43504461
37,52,Allen,"412, Irvine Drive, Watters Creek, Allen, Collin County, Texas, 75013, USA",33.09533497,-96.70009475
38,53,Bandera,"415, 1st Street, Bandera, Bandera County, Texas, 78003, USA",29.717039,-99.08212066
39,54,Humble,"7698, Desco Drive, Bordersville, Harris County, Texas, 77338, USA",30.01937977,-95.30818795
40,55,San Antonio,"Adobe Long House, East César E. Chávez Boulevard, Lavaca, San Antonio, Bexar County, Texas, 78206, USA",29.41542956,-98.48159614
41,56,Humble,"Pearson Carpet Care, 525, North Houston Avenue, Humble, Harris County, Texas, 77338, USA",30.00094259,-95.25816793
42,57,Fort Worth,"Amaranth Drive, Fort Worth, Tarrant County, Texas, 76428, USA",32.91753279,-97.33690001
43,58,Katy,"2733, Sable Ridge Lane, Parkway Oaks, Cinco Ranch, Fort Bend County, Texas, 77494, USA",29.75028228,-95.79191395
44,59,Irving,"Irving, Dallas County, Texas, 75039, USA",32.88088953,-96.94281767
45,61,Katy,"25546, Saddlebrook Way, Cinco Ranch, Fort Bend County, Texas, 77494, USA",29.75547877,-95.78899633
46,62,League City,"846, Davis Road, League City, Galveston County, Texas, 77573, USA",29.53971075,-95.07518536
47,66,Conroe,"754, Stonewall Jackson Drive, River Plantation, Montgomery County, Texas, 77302, USA",30.2447258,-95.4382271
48,67,San Antonio,"4336, Dauphine Drive, San Antonio, Bexar County, Texas, 78218, USA",29.48241384,-98.41001528
49,69,Concan,"Mountain Valley Road, Third Crossing, Uvalde County, Texas, 78838, USA",29.53213067,-99.69302161
50,71,Austin,"507, West Alpine Road, Dawson, Austin, Travis County, Texas, 78704, USA",30.23038507,-97.76581095
51,72,San Antonio,"8783, Tesoro Drive, San Antonio, Bexar County, Texas, 78217, USA",29.52007905,-98.45505578
52,75,Spring,"23206, Hill Creek Road, Harris County, Texas, 77373, USA",30.05041737,-95.34459326
53,79,College Station,"2977, Normand Drive, Southwood Valley, College Station, Brazos County, Texas, 77845, USA",30.58726186,-96.29515158
54,81,College Station,"2385, Colgate Circle, Castle Rock Apartments, College Station, Brazos County, Texas, 77840, USA",30.6133901,-96.30687282
55,82,Plano,"6899, Abernathy Street, Plano, Collin County, Texas, 75074, USA",33.067471,-96.6636928
56,83,Fort Worth,"5525, Eastwedge Drive, Fort Worth, Tarrant County, Texas, 76137, USA",32.88156439,-97.2658547
57,85,Austin,"6711, Modesto Street, Abercrombie, Austin, Travis County, Texas, 78757, USA",30.34285933,-97.73598704
58,86,Houston,"1428, Trailwood Village Drive, Houston, Harris County, Texas, 77339, USA",30.03683572,-95.22608777
59,87,San Antonio,"Camino Haven, The Enclave At Stonehaven, Bexar County, Texas, 78255, USA",29.70627939,-98.63299228
60,88,Irving,"3809, Flintridge Drive, Irving, Dallas County, Texas, 75038, USA",32.86410161,-96.99892108
61,89,Katy,"23367, Leaf Ridge Drive, Cinco Ranch, Fort Bend County, Texas, 77494, USA",29.75443391,-95.77315946
62,90,New Braunfels,"North Guenther Avenue, New Braunfels, Comal County, Texas, 78130, USA",29.70090884,-98.131561
63,91,Buchanan Dam,"98, Trinidad Street, Buchanan Dam, Llano County, Texas, 78609, USA",30.75022481,-98.41572007
64,92,Humble,"9498, Greencape Court, Dyersdale, Harris County, Texas, 77396, USA",29.92953838,-95.25096238
65,93,Baytown,"1908, North Main Street, Baytown, Harris County, Texas, 77520, USA",29.74584661,-94.96355953
66,95,Irving,"1955, Cloverleaf Lane, Irving, Dallas County, Texas, 75061, USA",32.83240526,-96.98926843
67,96,Bryan,"3669, Forestwood Drive, Saddlewood Apartments, Bryan, Brazos County, Texas, 77801, USA",30.6301763,-96.36748443
68,97,Houston,"Lowe's, Plum Creek Terrace Lane, Houston, Harris County, Texas, 77087, USA",29.69799127,-95.29893196
69,98,Eustace,"5798, County Road 1423, Henderson County, Texas, 75124, USA",32.22713635,-95.99408655
70,99,Conroe,"426, Oak Stream Drive, Conroe, Montgomery County, Texas, 77304, USA",30.28228127,-95.48712678
71,100,Colleyville,"5699, Texas Trail, Colleyville, Tarrant County, Texas, 76034, USA",32.89039189,-97.18186807
72,101,Mabank,"Sunray Street, Henderson County, Texas, 75156, USA",32.25334064,-96.0807898
73,102,Cibolo,"Schertz, Guadalupe County, Texas, 78108, USA",29.62122809,-98.22315851
74,103,New Braunfels,"176, Lakeview Boulevard, Landa Park Highlands, New Braunfels, Comal County, Texas, 78130, USA",29.716016,-98.13737076
75,107,Allen,"1518, Pine Bluff Drive, Allen, Collin County, Texas, 75002, USA",33.09131167,-96.6306321
76,108,Pipe Creek,"175, Mountain View Lane, Bandera County, Texas, 78063, USA",29.72770471,-98.86898766
77,109,Houston,"8620, Findlay Street, Houston, Harris County, Texas, 77017, USA",29.69300158,-95.26477971
78,110,College Station,"1503, Pine Ridge Drive, College Station, Brazos County, Texas, 77840, USA",30.60723597,-96.31728311
79,111,Houston,"2301, Congress Street, Houston, Harris County, Texas, 77003, USA",29.75561922,-95.34945333
80,112,Austin,"Velasquez Sports Complex, Lady Bird Lake Hike and Bike Trail, Lakeshore, Austin, Travis County, Texas, 78741, USA",30.24962237,-97.72215443
81,113,Katy,"2309, Horned Owl Drive, Hawks Landing, Fort Bend County, Texas, 77494, USA",29.74270525,-95.82376819
82,115,Dallas,"2008, Greenville Avenue, Lower Greenville, Dallas, Dallas County, Texas, 75206, USA",32.81433689,-96.76974606
83,116,Haltom City,"Fossil Ridge Drive, Haltom City, Tarrant County, Texas, 76136, USA",32.85314505,-97.27746618
84,117,Navasota,"360, Gibbs Street, Navasota, Grimes County, Texas, 77868, USA",30.38250015,-96.08396984
85,118,College Station,"Triumph Court, College Station, Brazos County, Texas, 77845, USA",30.56283264,-96.29118908
86,119,College Station,"738, Park Place, Callaway Villas, College Station, Brazos County, Texas, 77840, USA",30.60461863,-96.33028067
87,120,South Padre Island,"2028, Gulf Boulevard, South Padre Island, Cameron County, Texas, 78597, USA",26.0988938,-97.16416098
88,121,Dallas,"1344, Stewart Drive, Bishop Arts District, Dallas, Dallas County, Texas, 75208, USA",32.75532904,-96.84328076
89,122,Houston,"8076, Grafton Street, Houston, Harris County, Texas, 77017, USA",29.69217133,-95.27834702
90,123,Corpus Christi,"Third Coast Beach Company, Headsail Avenue, Mustang-Padre Island, Corpus Christi, Nueces County, Texas, USA",27.61934852,-97.22201559
91,124,Granbury,"1402, South Chisholm Trail, Mambrino, Hood County, Texas, 76048, USA",32.39882076,-97.75762567
92,125,Houston,"5539, Hillman Street, Plaza Santa Clara, Houston, Harris County, Texas, 77023, USA",29.72643595,-95.31921338
93,126,San Antonio,"1036, Thrush Ridge, San Antonio, Bexar County, Texas, 78248, USA",29.59687123,-98.52481313
94,127,Arlington,"6203, Castle Creek Road, Kennedale, Tarrant County, Texas, 76017, USA",32.66199838,-97.2060795
95,128,Dallas,"3916, Congress Avenue, Oak Lawn, Dallas, Dallas County, Texas, 75219, USA",32.80786908,-96.81199591
96,129,Port Aransas,"763, Access Rd 1-A, Mustang Beach, Port Aransas, Aransas County, Texas, 78373, USA",27.80544277,-97.08199531
97,130,Round Rock,"1609, Corn Hill Lane, Turtle Creek Village, Round Rock, Williamson County, Texas, 78664, USA",30.50945534,-97.65806608
98,131,Sweeny,"TX 35;FM 524, Old Ocean, Brazoria County, Texas, 77463, USA",29.08708319,-95.72306648
99,132,Euless,"239, Buckingham Avenue, Euless, Tarrant County, Texas, 76040, USA",32.8353312,-97.1085319
100,133,Plano,"Ridgeview Ranch Golf Club, Plano, Collin County, Texas, 75025, USA",33.11878882,-96.73917725
101,134,College Station,"Smetana, Brazos County, Texas, 77807, USA",30.62100356,-96.44929926
102,135,Humble,"Hampton Hills Drive, Laurel Place, Moonshine Hill, Harris County, Texas, 77338:77346, USA",29.98656912,-95.22818386
103,136,Conroe,"14895, Greenbough, Bennette Estates, Grangerland, Montgomery County, Texas, 77302, USA",30.20567661,-95.35012473
104,137,Frisco,"11550, Clipper Circle, Stewart Peninsula, Denton County, Texas, 75034, USA",33.11616758,-96.92762318
105,138,Sealy,"Beckendorff Road, Rexville, Austin County, Texas, 77474, USA",29.70852238,-96.22426265
106,139,San Antonio,"1489, Blackbridge, The Woods, Bexar County, Texas, 78253, USA",29.44439593,-98.71742703
107,140,Fort Worth,"3928, Clarke Avenue, Fort Worth, Tarrant County, Texas, 76107, USA",32.74822997,-97.37647856
108,141,San Antonio,"4601, Emory Oak Woods, Woods of Shavano, San Antonio, Bexar County, Texas, 78249, USA",29.58112385,-98.57656207
109,142,College Station,"Harvey Road, Summit Crossing, College Station, Brazos County, Texas, 77840, USA",30.64207031,-96.28920321
110,143,Houston,"5814, Effingham Drive, Houston, Harris County, Texas, 77035, USA",29.6465198,-95.48921278
111,146,Brenham,"1885, FM 50, Independence, Washington County, Texas, 77833, USA",30.2006913,-96.36471719
112,147,San Antonio,"4317, Parkwood Drive, San Antonio, Bexar County, Texas, 78218, USA",29.48217334,-98.40900329
113,148,Schertz,"Gettysburg Drive, The Village Subdivision Unit 4, Schertz, Guadalupe County, Texas, 78154, USA",29.55967872,-98.25797103
114,149,Carrollton,"Lakecrest Court, Carrollton, Dallas County, Texas, 75006, USA",32.96345053,-96.85590903
115,150,New Ulm,"Track Road, New Ulm, Austin County, Texas, 78950, USA",29.89822345,-96.50467836
116,151,Hempstead,"Pierceall Road, Pine Island, Waller County, Texas, 77445, USA",30.04281773,-96.04410223
117,152,Fayetteville,"Fayetteville High School, 618, North Rusk Street, Fayetteville, Fayette County, Texas, 78940, USA",29.9042624,-96.68324071
118,153,Fort Worth,"Forest Park Boulevard, Fort Worth, Tarrant County, Texas, 76102, USA",32.75373575,-97.34248488
119,154,Montgomery,"Lake Estates Drive, Lake Estates, Montgomery County, Texas, 77356, USA",30.40323913,-95.61173104
120,156,Richmond,"10475, Shanley Trace Lane, Shiloh Lake Estates, Fort Bend County, Texas, 77407, USA",29.6610122,-95.68753793
121,157,Cleburne,"4841, Looney Lane, Egan, Johnson County, Texas, 76031, USA",32.47382302,-97.28549216
122,158,New Braunfels,"692, Comal Avenue, New Braunfels, Comal County, Texas, 78130, USA",29.69792115,-98.11524852
123,159,New Braunfels,"Comal River, South Gilbert Avenue, New Braunfels, Comal County, Texas, 78130, USA",29.7068023,-98.12265949
124,160,Kemah,"722, 6th Street, Kemah, Galveston County, Texas, 77565, USA",29.54380153,-95.0170362
125,161,Irving,"456, Lacebark Drive, Valley Ranch, Irving, Dallas County, Texas, 75063, USA",32.91786622,-96.95068721
126,163,Austin,"216, East 4th Street, Downtown, Austin, Travis County, Texas, 78701, USA",30.26594744,-97.74144275
127,164,Concan,"Third Crossing, Uvalde County, Texas, 78838, USA",29.54128208,-99.69037872
128,165,Richmond,"399, Waterside Estates Circle, Waterside Estates, Pecan Grove, Fort Bend County, Texas, 77406, USA",29.64864295,-95.7353304
129,166,Austin,"6017, Salcon Cliff Drive, Legend Oaks, Austin, Travis County, Texas, 78749, USA",30.20515821,-97.8782895
130,167,College Station,"Carriker Court, Royder, Brazos County, Texas, 77881, USA",30.51712322,-96.30567554
131,177,Corpus Christi,"Comfort Inn And Suites, Windward Drive, Mustang-Padre Island, Corpus Christi, Nueces County, Texas, USA",27.6048345,-97.21074843
132,179,Houston,"3025, Taft Street, Houston, Harris County, Texas, 77006, USA",29.74485117,-95.38589969
133,184,Richmond,"17459, Hanoverian Drive, Shiloh Lake Estates, Fort Bend County, Texas, 77407, USA",29.659386,-95.69020939
134,185,Austin,"4501, Gillis Street, South Manchaca, Austin, Travis County, Texas, 78745, USA",30.22363485,-97.78329845
135,186,Austin,"1301, Cedar Avenue, Chestnut, Austin, Travis County, Texas, 78722, USA",30.2759184,-97.71321066
136,187,Dallas,"2629, Millmar Drive, Dallas, Dallas County, Texas, 75228, USA",32.82679167,-96.67012107
137,188,Austin,"2918, East Martin Luther King Jr Boulevard, Chestnut, Austin, Travis County, Texas, 78722, USA",30.28283226,-97.70820152
138,189,Bridge City,"Orange County, Texas, USA",30.03761263,-93.8103071
139,190,Dallas,"5426, McCommas Boulevard, Knox, Dallas, Dallas County, Texas, 75206, USA",32.82957241,-96.77609658
140,191,Lago Vista,"3404, American Drive, Lago Vista, Travis County, Texas, 78645, USA",30.44054759,-98.02017659
141,192,Rockport,"588, Newcomb Bend Loop, Holiday Beach, Aransas County, Texas, 78382, USA",28.16218221,-97.01599643
142,193,Tow,"1221, Manor Street, Buchanan Lake Village, Llano County, Texas, 78672, USA",30.85041949,-98.44988581
143,194,Rockport,"North Fulton Beach Road, Fulton, Aransas County, Texas, 78358, USA",28.100134,-97.03050334
144,195,Bridgeport,"Rickels, Wise County, Texas, 76426, USA",33.16989692,-97.85160453
145,196,Kingsville,"906, West Lee Avenue, Kingsville, Kleberg County, Texas, 78363, USA",27.52007545,-97.87982068
146,197,Kyle,"Plum Creek Golf Course, 4301, Benner, Kyle, Hays County, Texas, 78640, USA",30.01653024,-97.87897809
147,198,Houston,"1632, Kipling Street, Houston, Harris County, Texas, 77006, USA",29.74051972,-95.40024893
148,199,San Antonio,"23718, I-10 Frontage Road, Leon Springs, San Antonio, Bexar County, Texas, 78257, USA",29.66329734,-98.62682747
149,200,Dallas,"Uptown PID, Dallas, Dallas County, Texas, 75204, USA",32.80743307,-96.79499383
150,201,Killeen,"5499, Donegal Bay Court, Killeen, Bell County, Texas, 76549, USA",31.08205155,-97.80998783
151,202,Converse,"4015, Mistflower Drive, Bexar County, Texas, 78109, USA",29.46611326,-98.32325103
152,203,Lakeway,"718, Bermuda Street, Lakeway, Travis County, Texas, 78734, USA",30.3712411,-97.98738926
153,204,Corpus Christi,"354, Naples Street, Coopers Alley L-Head, Downtown, Corpus Christi, Nueces County, Texas, 78404, USA",27.77152417,-97.39531271
154,205,Dallas,"6006, Mercedes Avenue, Lower Greenville, Dallas, Dallas County, Texas, 75214, USA",32.82768128,-96.76334642
155,206,Fort Worth,"2417, Westbrook Avenue, Fort Worth, Tarrant County, Texas, 76111, USA",32.77950286,-97.31058639
156,207,Brenham,"Edgar Matchett House, West Main Street, Brenham, Washington County, Texas, 77833, USA",30.1662184,-96.40225125
157,208,Galveston,"DoubleTree by Hilton Hotel Galveston Beach, Avenue O ½, Galveston, Galveston County, Texas, 77550, USA",29.29448803,-94.78369067
158,209,Terlingua,"Indian Head Road, Study Butte, Brewster County, Texas, USA",29.33986422,-103.5259311
159,210,Corpus Christi,"15004, Leeward Drive, Mustang-Padre Island, Corpus Christi, Nueces County, Texas, 78418, USA",27.60545708,-97.21130202
160,211,Houston,"1398, Stanford Street, Houston, Harris County, Texas, 77019, USA",29.75484482,-95.38913101
161,212,Euless,"Fountainview Drive, Euless, Tarrant County, Texas, 76039, USA",32.86431109,-97.08096908
162,213,Houston,"4190, Westpark Drive, Houston, Harris County, Texas, 77027, USA",29.72758048,-95.44585328
163,214,Bastrop,"A. A. Erhard House, Pecan Street, Bastrop, Bastrop County, Texas, 78602, USA",30.11212414,-97.31763093
164,215,San Antonio,"1572, Moonlit Grove, Wetmore, San Antonio, Bexar County, Texas, 78247, USA",29.57813711,-98.43065619
165,216,Buchanan Dam,"180, North Greenwool Drive, Golden Beach, Llano County, Texas, 78609, USA",30.80317036,-98.46823953
166,217,Houston,"2734, Mason Street, Houston, Harris County, Texas, 77006, USA",29.74603384,-95.38480976
167,218,River Oaks,"1315, Banks Street, River Oaks, Tarrant County, Texas, 76114, USA",32.78062233,-97.38818431
168,219,Austin,"3216, Pearce Road, Austin, Travis County, Texas, 78730, USA",30.33816909,-97.82413058
169,220,League City,"League City, Galveston County, Texas, 77573, USA",29.48554549,-95.0843968
170,221,Saginaw,"893, Willow Court, Saginaw, Tarrant County, Texas, 76179, USA",32.85276234,-97.37723606
171,222,Belton,"781, East Avenue O, Belton, Bell County, Texas, 76513, USA",31.04230373,-97.46023665
172,223,Houston,"658, Harold Street, Houston, Harris County, Texas, 77006, USA",29.74181448,-95.38729022
173,224,Arlington,"2012, North Davis Drive, Arlington, Tarrant County, Texas, 76012, USA",32.76776958,-97.12382879
174,225,Arlington,"3420, Redstone Drive, Arlington, Tarrant County, Texas, 76001, USA",32.64135699,-97.16317067
175,226,Katy,"25661, Tower Side Lane, Sedona, Cinco Ranch, Fort Bend County, Texas, 77494, USA",29.70415124,-95.82280558
176,227,Austin,"905, East 7th Street, East Sixth, Austin, Travis County, Texas, 78702, USA",30.26611565,-97.7327258
177,228,McKinney,"6988, Wind Row Drive, McKinney, Collin County, Texas, 75070, USA",33.15732832,-96.70865246
178,229,Bandera,"205, 10th Street, Bandera, Bandera County, Texas, 78003, USA",29.722388,-99.07181852
179,230,Houston,"Walmart Neighborhood Market, 9700, Hillcroft Avenue, Houston, Harris County, Texas, 77096, USA",29.67438932,-95.49536038
180,231,Canyon,"White Fence Road, Randall County, Texas, 79016, USA",35.02061454,-101.9001074
181,232,Temple,"4763, Arrowhead Drive, Temple, Bell County, Texas, 76502, USA",31.08315027,-97.4021393
182,233,Austin,"2102, Keepsake Drive, Grand Oaks, Austin, Travis County, Texas, 78748, USA",30.18835401,-97.81606795
183,234,Little Elm,"3775, Misty Cove, Little Elm, Denton County, Texas, 75068, USA",33.15256985,-96.96912275
184,235,Richmond,"Victoria Springs Drive, Sonoma Ridge, Fort Bend County, Texas, 77407, USA",29.68569362,-95.72351852
185,236,League City,"3102, Sand Reef Lane, Bay Ridge, League City, Galveston County, Texas, 77573, USA",29.50904258,-95.03171378
186,237,Galveston,"Galveston City Hall, Rosenberg Avenue - 25th Street, Galveston, Galveston County, Texas, 77553, USA",29.30142486,-94.79507861
187,238,Rockport,"792, Copano Cove Road, Aransas County, Texas, 78382, USA",28.07069945,-97.10866929
188,239,Houston,"345, Drennan Street, Houston, Harris County, Texas, 77003, USA",29.74678384,-95.33610475
189,240,Corpus Christi,"Corpus Christi North Beach, Corpus Christi Beach Walk, Peoples Street T-Head, Downtown, Corpus Christi, Nueces County, Texas, 78402, USA",27.82631852,-97.38456603
190,241,League City,"901, Ponte Serena Drive, The Lakes at South Shore Harbor, League City, Galveston County, Texas, 77573, USA",29.51437679,-95.05881077
191,242,Tool,"Tool, Henderson County, Texas, USA",32.30601165,-96.17988225
192,243,South Padre Island,"193, Pike Street, South Padre Island, Cameron County, Texas, 78597, USA",26.10259094,-97.16508523
193,244,Dallas,"2122, North Peak Street, Lower Greenville, Dallas, Dallas County, Texas, 75204, USA",32.80439082,-96.78496543
194,245,Sugar Land,"6762, Charlton Street, Telfair, Sugar Land, Fort Bend County, Texas, 77479, USA",29.58141125,-95.65816858
195,246,Rockport,"54, Nassau Drive, Key Allegro, Rockport, Aransas County, Texas, 78382, USA",28.04548923,-97.02933703
196,247,San Antonio,"A.R.T. Massage Body Spa, 215, West Sunset Road, Oak Park, San Antonio, Bexar County, Texas, 78209, USA",29.50823937,-98.46991898
197,248,Denton,"East Windsor Drive, Denton, Denton County, Texas, 76209, USA",33.24276568,-97.11244473
198,249,Galveston,"Maravilla Resort Condominiums, 9520, Seawall Boulevard, Galveston, Galveston County, Texas, 77551, USA",29.24702215,-94.85914419
199,250,Galveston,"3623, Avenue S ½, Galveston, Galveston County, Texas, 77550, USA",29.28171507,-94.80228138
200,251,Seabrook,"4464, Spoonbill Drive, Seabrook, Harris County, Texas, 77586, USA",29.58307462,-95.01420299
201,252,Rogers,"12431, Reeds Lake Loop, Academy, Bell County, Texas, 76569, USA",30.9665972,-97.31752936
202,253,Rockport,"Salt Lake, Salt Lake Road, Copano Village, Aransas County, Texas, 78381, USA",28.07749649,-97.09183996
203,254,Houston,"Stanton's City Bites, 1420, Edwards Street, North Inner Loop, Houston, Harris County, Texas, 77007, USA",29.77073164,-95.37220398
204,255,Fort Worth,"1812, Tremont Avenue, Fort Worth, Tarrant County, Texas, 76107, USA",32.74194821,-97.38246834
205,256,Harker Heights,"1627, Inca Drive, Harker Heights, Bell County, Texas, 76548, USA",31.06351199,-97.63620315
206,257,Austin,"4908, Alf Avenue, Johnston Terrace, Austin, Travis County, Texas, 78721, USA",30.26704789,-97.68989589
207,258,Terlingua,"Terlingua Ranch Road, Brewster County, Texas, 79852, USA",29.49263134,-103.3699133
208,259,Austin,"713, Brownlee Circle, Clarksville, Austin, Travis County, Texas, 78703, USA",30.27456699,-97.7580592
209,260,Houston,"8499, Hearth Drive, Houston, Harris County, Texas, 77054, USA",29.68086261,-95.41870216
210,261,Arlington,"Spring Hill Suites, East Lamar Boulevard, Arlington, Tarrant County, Texas, 76011, USA",32.76386606,-97.07894896
211,262,Hickory Creek,"1140, Point Vista Road, Hickory Creek, Denton County, Texas, 75065, USA",33.11962689,-97.03793115
212,263,Grapevine,"The Church of Jesus Christ of Latter-day Saints, 1143, Butterfield Drive, Grapevine, Tarrant County, Texas, 76051, USA",32.94863427,-97.06999168
213,264,Buda,"149, Feathergrass Drive, Green Meadows, Buda, Hays County, Texas, 78610, USA",30.05988156,-97.8143251
214,265,Dallas,"4333, McKinney Avenue, Knox, Knox Street PID, Dallas, Dallas County, Texas, 75205, USA",32.81926424,-96.78957175
215,266,College Station,"1596, Welsh Avenue, Callaway Villas, College Station, Brazos County, Texas, 77840, USA",30.59607091,-96.32442712
216,267,Houston,"El Camino Real, Houston, Harris County, Texas, 77062, USA",29.58231323,-95.14569045
217,268,Canton,"4288, Farm-to-Market Road 1651, Whitton, Van Zandt County, Texas, 75103, USA",32.47332279,-95.90929916
218,269,Austin,"206, Clearday Drive, Buckingham Ridge, Austin, Travis County, Texas, 78745, USA",30.19237135,-97.7816127
219,270,Austin,"5714, Lark Creek Drive, Southeast Austin, Austin, Travis County, Texas, 78744, USA",30.1925213,-97.73138523
220,271,Celina,"4853, County Road 179, Weston, Collin County, Texas, 75009, USA",33.39699026,-96.66455138
221,272,College Station,"The Tradition at Northgate, Boyett Street, Saddlewood Apartments, Bryan, Brazos County, Texas, 77840, USA",30.61890295,-96.34894008
