,id,City,Address,lat,lon
1748,13477,Baytown,"Egret Bay Circle, Cove, Chambers County, Texas, 77523, USA",29.81798231,-94.85336745
1749,13478,San Antonio,"513, East Mistletoe Avenue, Monte Vista, San Antonio, Bexar County, Texas, 78212, USA",29.45371669,-98.48805041
1750,13481,Rockport,"18, Bimini Drive, Key Allegro, Rockport, Aransas County, Texas, 78382, USA",28.03570495,-97.03212279
1751,13482,League City,"2969, Doral Court, League City, Galveston County, Texas, 77573, USA",29.53021426,-95.0580968
1752,13483,Corpus Christi,"Schlitterbahn Waterpark Corpus Christi, 14353, Commodore Street, Mustang-Padre Island, Corpus Christi, Nueces County, Texas, 78418, USA",27.61678456,-97.22633408
1753,13486,Baytown,"4801, Spring Lane, Baytown, Harris County, Texas, 77521, USA",29.77475294,-94.92089249
1754,13487,Dallas,"193, North Akard Street, West End Historic District, Downtown PID, Dallas, Dallas County, Texas, 75201, USA",32.78118768,-96.79968935
1755,13488,Plano,"Brisbane Lane, Plano, Collin County, Texas, 75075, USA",33.03047334,-96.73242695
1756,13489,San Antonio,"Saint Mary's Strip, San Antonio, Bexar County, Texas, 78212, USA",29.46779316,-98.48768264
1757,13490,Houston,"1407, New Cedars Drive, Houston, Harris County, Texas, 77062, USA",29.58543474,-95.13751273
1758,13491,Corpus Christi,"Boat House, Windward Drive, Mustang-Padre Island, Corpus Christi, Nueces County, Texas, USA",27.60259846,-97.21341989
1759,13492,Dripping Springs,"662, Bell Springs Road, Hays County, Texas, 78620, USA",30.29500494,-98.09225355
1760,13493,Baytown,"8498, Broadleaf Avenue, McNair, Harris County, Texas, 77521, USA",29.81594891,-94.99622339
1761,13494,Kemah,"807, Kipp Avenue, Kemah, Galveston County, Texas, 77565, USA",29.5417041,-95.01681621
1762,13495,Houston,"301, Overland Park Drive, Cloverleaf, Harris County, Texas, 77049, USA",29.81022873,-95.16967031
1763,13496,Houston,"3153, Hicks Street, North Inner Loop, Houston, Harris County, Texas, 77007, USA",29.77127888,-95.39168107
1764,13497,Dallas,"1910, Mc Millan Avenue, Lower Greenville, Dallas, Dallas County, Texas, 75206, USA",32.81349056,-96.77444189
1765,13498,Richmond,"7815, Hollow Bluff Lane, Twin Oaks Village, Fort Bend County, Texas, 77407, USA",29.69322013,-95.69025651
1766,13499,Fort Worth,"4408, Billings Road, Castle Hill Estate, Tarrant County, Texas, 76108, USA",32.82035559,-97.51260779
1767,13500,San Leon,"573, 2nd Street, San Leon, Galveston County, Texas, 77539, USA",29.48707805,-94.91393158
1768,13501,Arlington,"516, Lamplighter Circle, Arlington, Tarrant County, Texas, 76012, USA",32.73977493,-97.14547073
1769,13502,McKinney,"West Quisenberry Street, McKinney, Collin County, Texas, 75069, USA",33.19606864,-96.62746702
1770,13503,Dallas,"Taco Borracho, 318, Bryan Street, West End Historic District, Downtown PID, Dallas, Dallas County, Texas, 75270, USA",32.78238233,-96.79948831
1771,13508,Malakoff,"Shoreline Drive, Star Harbor, Henderson County, Texas, 75148, USA",32.19881759,-96.05974433
1772,13509,Fort Worth,"Double Eagle Boulevard, Fort Worth, Denton County, Texas, 76177, USA",33.02452319,-97.29988966
1773,13510,Plano,"4651, Reunion Drive, Plano, Collin County, Texas, 75024, USA",33.08055376,-96.79101723
1774,13511,Dallas,"11533, Lochwood Boulevard, Dallas, Dallas County, Texas, 75218, USA",32.85149565,-96.69101867
1775,13512,Sugar Land,"899, Skimmer Court, Sugar Land, Fort Bend County, Texas, 77478, USA",29.61048222,-95.62321542
1776,13513,Sugar Land,"US 90A, Sugar Land, Fort Bend County, Texas, 77478, USA",29.62254549,-95.62472218
1777,13514,Houston,"City Place Apartments, 206, McGowen Street, Houston, Harris County, Texas, 77006, USA",29.74957941,-95.38125539
1778,13515,Houston,"169, Velasco Street, Houston, Harris County, Texas, 77003, USA",29.75174814,-95.34088563
1779,13517,Fort Worth,"414, University Drive, Fort Worth, Tarrant County, Texas, 76107, USA",32.75447983,-97.36127966
1780,13518,Houston,"2442, Oakdale Street, Houston, Harris County, Texas, 77004, USA",29.71972965,-95.37566152
1781,13519,Corpus Christi,"14701, Whitecap Boulevard, Mustang-Padre Island, Corpus Christi, Nueces County, Texas, 78418, USA",27.60110235,-97.21590088
1782,13520,Cedar Creek,"Linam Lane, High Grove, Bastrop County, Texas, 78612, USA",30.04656127,-97.53249084
1783,13521,Corpus Christi,"160, Courtland Drive, Flour Bluff, Corpus Christi, Nueces County, Texas, 78418, USA",27.62276668,-97.29452209
1784,13522,McKinney,"530, West Lamar Street, McKinney, Collin County, Texas, 75069, USA",33.200683,-96.61899164
1785,13523,Kemah,"722, 6th Street, Kemah, Galveston County, Texas, 77565, USA",29.54380153,-95.0170362
1786,13524,Corpus Christi,"1868, 3rd Street, Coopers Alley L-Head, Downtown, Corpus Christi, Nueces County, Texas, 78404, USA",27.77347561,-97.39386424
1787,13525,Houston,"2002, McClendon Street, Houston, Harris County, Texas, 77030, USA",29.70859411,-95.40498089
1788,13526,Euless,"3550, Euless South Main Street, Arlington, Tarrant County, Texas, 76040, USA",32.81473116,-97.08226433
1789,13527,Rockport,"1365, North Fulton Beach Road, Fulton, Aransas County, Texas, 78382, USA",28.08301384,-97.035926
1790,13528,Cedar Creek,"Cedar Creek, Bastrop County, Texas, 78612, USA",30.08671982,-97.52426001
1791,13529,Plano,"Parkwood Boulevard, Plano, Collin County, Texas, 75024, USA",33.0717954,-96.81836488
1792,13530,Rockport,"1198, East Nopal Street, Rockport, Aransas County, Texas, 78382, USA",28.02937317,-97.05115888
1793,13531,League City,"Pegasus Lane, League City, Galveston County, Texas, 77058, USA",29.5434035,-95.07377209
1794,13532,Richmond,"859, Mayweather Lane, Pecan Grove, Fort Bend County, Texas, 77406, USA",29.60776947,-95.72676849
1795,13533,Rockport,"65, Curlew Drive, Key Allegro, Rockport, Aransas County, Texas, 78382, USA",28.03552818,-97.03154342
1796,13535,Balch Springs,"14898, South Spring Ridge Circle, Balch Springs, Dallas County, Texas, 75180, USA",32.70946833,-96.58871754
1797,13536,Manor,"13705, Field Stream Lane, Presidential Meadows, New Katy, Travis County, Texas, 78653, USA",30.35945271,-97.5427359
1798,13537,Abilene,"Cimarron Trail, Wylie, Taylor County, Texas, 79606, USA",32.3490101,-99.77215927
1799,13538,Galveston,"922, Clara Street, Crystal Beach, Galveston County, Texas, 77650, USA",29.46342474,-94.6118982
1800,13539,San Antonio,"2854, Woodcliffe Street, San Antonio, Bexar County, Texas, 78230, USA",29.51342862,-98.53916791
1801,13540,Denton,"622, Fulton Street, Denton, Denton County, Texas, 76201, USA",33.22011827,-97.14314687
1802,13542,Rockport,"506, East Bay Street, Rockport, Aransas County, Texas, 78382, USA",28.02043414,-97.05716304
1803,13543,Katy,"Holton Ridge Drive, King Lakes, Cinco Ranch, Fort Bend County, Texas, 77494, USA",29.73618922,-95.79539105
1804,13544,Galveston,"900, South Stingaree Drive, Bolivar Peninsula, Galveston County, Texas, 77650, USA",29.47021268,-94.59206422
1805,13545,Grand Saline,"2993, US 80, Grand Saline, Van Zandt County, Texas, 75140, USA",32.67337795,-95.65452121
1806,13546,Corpus Christi,"Schlitterbahn Waterpark Corpus Christi, 14353, Commodore Street, Mustang-Padre Island, Corpus Christi, Nueces County, Texas, 78418, USA",27.61098334,-97.22356702
1807,13548,Houston,"779, Highlands Shores Road, Highlands, Harris County, Texas, 77562, USA",29.83655048,-95.06831786
1808,13549,Houston,"2681, Persa Street, Houston, Harris County, Texas, 77098, USA",29.74109345,-95.41219452
1809,13550,Fort Worth,"4821, Scots Briar Lane, Fort Worth, Tarrant County, Texas, 76137, USA",32.86719446,-97.28002546
1810,13551,San Antonio,"188, Valero Street, Saint Mary's Strip, San Antonio, Bexar County, Texas, 78212, USA",29.44825299,-98.4837863
1811,13552,Denton,"2123, Greenway Drive, Denton, Denton County, Texas, 76207, USA",33.23768796,-97.17311237
1812,13553,Kemah,"708, Bradford Avenue, Kemah, Galveston County, Texas, 77565, USA",29.54185988,-95.01822927
1813,13554,Corpus Christi,"14230, East Cabana Street, Mustang-Padre Island, Corpus Christi, Nueces County, Texas, 78418, USA",27.62100214,-97.22404266
1814,13555,Fort Worth,"North Academy Boulevard, Fort Worth, Tarrant County, Texas, 76108, USA",32.76787583,-97.49084809
1815,13556,Fort Worth,"6769, Confederate Park Road, Castle Hill Estate, Tarrant County, Texas, 76108, USA",32.82239369,-97.51142775
1816,13557,Baytown,"137, East Cedar Bayou Lynchburg Road, Baytown, Harris County, Texas, 77521, USA",29.77909695,-94.95985531
1817,13558,League City,"League City, Galveston County, Texas, 77565, USA",29.54182917,-95.05745849
1818,13559,Galveston,"Maravilla Resort Condominiums, 9520, Seawall Boulevard, Galveston, Galveston County, Texas, 77551, USA",29.24797702,-94.85868799
1819,13560,Fort Worth,"10499, Meadow Gate Drive, Fort Worth, Tarrant County, Texas, 76108, USA",32.73841484,-97.50934072
1820,13561,Houston,"Fannin School, Anita Street, Houston, Harris County, Texas, 77004, USA",29.74439903,-95.37938988
1821,13562,Houston,"5099, Leafy Hollow Court, Candlelight Estates, Houston, Harris County, Texas, 77018, USA",29.83831494,-95.43123773
1822,13563,Houston,"3695, Engelke Street, Houston, Harris County, Texas, 77003, USA",29.75322296,-95.33423339
1823,13564,Flint,"18210, FM 2661, Pine Trail Estates, Smith County, Texas, 75762, USA",32.21695445,-95.45169835
1824,13565,Bedford,"3411, Pin Oak Lane, Bedford, Tarrant County, Texas, 76021, USA",32.8629865,-97.11824059
1825,13566,Houston,"3843, Main Street, Houston, Harris County, Texas, 77002, USA",29.73747911,-95.38006885
1826,13567,San Antonio,"189, Newell Avenue, Pearl, San Antonio, Bexar County, Texas, 78212, USA",29.44099779,-98.48254953
1827,13568,Sugar Land,"New Territory Boulevard, New Territory, Fort Bend County, Texas, 77479, USA",29.58974778,-95.67943554
1828,13569,Corpus Christi,"Whitecap Boulevard, Mustang-Padre Island, Corpus Christi, Nueces County, Texas, USA",27.5998679,-97.21710873
1829,13571,Dallas,"1025, Haines Avenue, Bishop Arts District, Dallas, Dallas County, Texas, 75208, USA",32.75569485,-96.82925875
1830,13572,Houston,"5800, Burgoyne Road, Briargrove, Houston, Harris County, Texas, 77057, USA",29.74291613,-95.48407744
1831,13573,Houston,"2674, Austin Street, Houston, Harris County, Texas, 77004, USA",29.74284102,-95.37120649
1832,13574,Plano,"1473, Coffeyville Trail, Plano, Collin County, Texas, 75023, USA",33.06262249,-96.72124966
1833,13577,Dallas,"5555, East Mockingbird Lane, University Crossing PID, Dallas, Dallas County, Texas, 75206, USA",32.83696442,-96.77333101
1834,13579,Rockport,"TX 35-L Business, Rockport, Aransas County, Texas, 78381, USA",27.9813096,-97.08616146
1835,13580,Fort Worth,"3405, Hamilton Avenue, Fort Worth, Tarrant County, Texas, 76107, USA",32.75447927,-97.36697788
1836,13581,San Antonio,"424, Shropshire Drive, San Antonio, Bexar County, Texas, 78217, USA",29.52125817,-98.45052235
1837,13582,Dallas,"1006, Clermont Avenue, Dallas, Dallas County, Texas, 75223, USA",32.80306574,-96.74043698
1838,13583,Austin,"1501, Canyon View, Windsong Estates, West Lake Hills, Travis County, Texas, 78746, USA",30.30430235,-97.80405313
1839,13584,Houston,"715, Merrill Street, North Inner Loop, Houston, Harris County, Texas, 77009, USA",29.78901286,-95.37964933
1840,13585,Roanoke,"First Baptist Church of Roanoke, Bowie Street, Roanoke, Denton County, Texas, 76262, USA",32.99730515,-97.22884079
1841,13587,Katy,"Soapstone Terrace Lane, Silver Ranch, Fort Bend County, Texas, 77494, USA",29.74271424,-95.8364206
1842,13588,McKinney,"2433, Woodlawn Road, McKinney, Collin County, Texas, 75071, USA",33.22024732,-96.59980986
1843,13589,Dickinson,"1350, Pin Oak Drive, Dickinson, Galveston County, Texas, 77539, USA",29.46625301,-95.07525972
1844,13590,Port Neches,"355, Twin City Highway, Port Neches, Jefferson County, Texas, 77642, USA",29.95507947,-93.96039105
1845,13592,Lewisville,"1447, Drake Lane, Lewisville, Denton County, Texas, 75077, USA",33.07399872,-97.03294754
1846,13593,Bay City,"Matagorda County, Texas, USA",28.78273844,-95.60570808
1847,13594,McKinney,"10594, Bolivar Drive, McKinney, Collin County, Texas, 75070, USA",33.1878847,-96.76109783
1848,13595,League City,"4783, Broadmoor Drive, The Lakes at South Shore Harbor, League City, Galveston County, Texas, 77573, USA",29.52651223,-95.04930075
1849,13596,Denton,"ABC Preschool and Childcare, 808, East Sherman Drive, Denton, Denton County, Texas, 76209, USA",33.23734753,-97.1231642
1850,13597,Eustace,"Ponderosa Drive, Henderson County, Texas, 75124:75142, USA",32.30379739,-96.10465286
1851,13599,Kemah,"707, 7th Street, Kemah, Galveston County, Texas, 77565, USA",29.54339202,-95.01657964
1852,13600,Euless,"Highview Drive, Euless, Tarrant County, Texas, 76039, USA",32.85314128,-97.07338154
1853,13601,Baytown,"Spring Park Drive, McNair, Harris County, Texas, 77521, USA",29.8178296,-94.9826179
1854,13603,Irving,"3900, Boise Court, Irving, Dallas County, Texas, 75062, USA",32.84840737,-97.0037622
1855,13604,Plano,"2676, Corby Drive, Plano, Collin County, Texas, 75025, USA",33.07704895,-96.74663009
1856,13605,Dallas,"The Element, 1800, Main Street, West End Historic District, Downtown PID, Dallas, Dallas County, Texas, 75201, USA",32.78115053,-96.79622647
1857,13606,Houston,"150, Hyde Park Boulevard, Houston, Harris County, Texas, 77006, USA",29.74786989,-95.38437558
1858,13607,Sugar Land,"Knoll Crest Court, Greatwood, Crabb, Fort Bend County, Texas, 77479, USA",29.54805526,-95.6887051
1859,13608,Houston,"1598, Saxony Lane, Nassau Bay, Harris County, Texas, 77058, USA",29.54632922,-95.09459296
1860,13609,Corpus Christi,"15050, Windward Drive, Mustang-Padre Island, Corpus Christi, Nueces County, Texas, 78418, USA",27.60374902,-97.21016821
1861,13610,Houston,"5257, Bell Street, Houston, Harris County, Texas, 77023, USA",29.73350203,-95.32196865
1862,13611,Galveston,"1798, 16th Street, Galveston, Galveston County, Texas, 77550, USA",29.29568456,-94.78159414
1863,13612,Galveston,"1566, Christopher Columbus Boulevard - 14th Street, Galveston, Galveston County, Texas, 77550, USA",29.29809162,-94.77999083
1864,13615,Corpus Christi,"Compass Street, Mustang-Padre Island, Corpus Christi, Nueces County, Texas, 78418, USA",27.61988469,-97.22384435
1865,13619,Rockport,"223, Lands End Road, Estes, Shell Ridge, Aransas County, Texas, 78382, USA",27.96573196,-97.09666301
1866,13620,Copper Canyon,"Copper Canyon Road, Lantana, Copper Canyon, Denton County, Texas, 76226, USA",33.09592056,-97.10773836
1867,13621,Pilot Point,"9375, FM 1385, Pilot Point, Denton County, Texas, 76258, USA",33.33090418,-96.90291139
1868,13622,San Antonio,"Kingdom Hall of Jehovahs Witnesses, West Mistletoe Avenue, Alta Vista, San Antonio, Bexar County, Texas, 78212, USA",29.45337643,-98.50870466
1869,13624,Houston,"Highland Village, Houston, Harris County, Texas, WESLAYAN STREET, USA",29.73851071,-95.43845175
1870,13625,Richmond,"23423, Parkway Lakes Lane, Meadows of Parkway Lakes, Cinco Ranch, Fort Bend County, Texas, 77407, USA",29.6992915,-95.77025321
1871,13626,Dallas,"1027, Sarasota Circle, Dallas, Dallas County, Texas, 75223, USA",32.80111385,-96.74162238
1872,13627,Denton,"North Bonnie Brae Street, Denton, Denton County, Texas, 76201, USA",33.22202587,-97.16195179
1873,13628,Richmond,"17498, Aspen Ridge Court, Twin Oaks Village, Fort Bend County, Texas, 77407, USA",29.69552664,-95.69011086
1874,13629,Houston,"Metropolitan Community Church of the Resurrection, Decatur Street, North Inner Loop, Houston, Harris County, Texas, 77007, USA",29.7670954,-95.37666483
1875,13633,Hurst,"1992, Cimarron Trail, Hurst, Tarrant County, Texas, 76054, USA",32.85123483,-97.18290181
1876,13634,Dallas,"3130, Lemmon Avenue, Uptown PID, Dallas, Dallas County, Texas, 75204:75235, USA",32.80710912,-96.79962463
1877,13636,Dallas,"721, North Winnetka Avenue, Bishop Arts District, Dallas, Dallas County, Texas, 75208, USA",32.75148292,-96.84095185
1878,13637,Dallas,"7421, Frankford Road, Dallas, Collin County, Texas, 75252, USA",33.00203287,-96.77815395
1879,13639,Arlington,"Northwest Green Oaks Boulevard, Arlington, Tarrant County, Texas, 76006, USA",32.78563086,-97.10665342
1880,13640,Bastrop,"141, Kahalulu Drive, Hills Prairie, Bastrop County, Texas, 78602, USA",30.08259227,-97.27522523
1881,13641,Richmond,"West Grand Parkway South Frontage Road, Pecan Grove, Fort Bend County, Texas, 77406, USA",29.66097072,-95.74023375
1882,13642,Houston,"1556, Nevada Street, Houston, Harris County, Texas, 77006, USA",29.75094627,-95.39963185
1883,13643,Cedar Creek,"Wyldwood, Bastrop County, Texas, USA",30.1006731,-97.45802596
1884,13644,Austin,"5406, Larchbrook Drive, Imperial Valley, Travis County, Texas, 78724, USA",30.27590705,-97.62522326
1885,13645,Richmond,"Clayton Canyon Lane, Westheimer Lakes, Foster, Fort Bend County, Texas, USA",29.6916978,-95.83541909
1886,13646,McKinney,"462, South Church Street, McKinney, Collin County, Texas, 75069, USA",33.1942321,-96.61762469
1887,13647,Dallas,"2833, Kings Road, Highland Park, Dallas County, Texas, 75219, USA",32.81674906,-96.82179107
1888,13648,Sugar Land,"Emerald Glen Court, Greatwood, Crabb, Fort Bend County, Texas, 77479, USA",29.5484089,-95.68734028
1889,13649,Plano,"910, Goodwin Drive, Plano, Collin County, Texas, 75023, USA",33.05360386,-96.71071331
1890,13650,Austin,"2007, East 12th Street, Central East Austin, Austin, Travis County, Texas, 78721, USA",30.27362822,-97.71812102
1891,13651,Fort Worth,"3509, Hamilton Avenue, Fort Worth, Tarrant County, Texas, 76107, USA",32.75475321,-97.36890998
1892,13653,San Antonio,"182, Gibson Street, Dignowity Hill, San Antonio, Bexar County, Texas, 78202, USA",29.43241571,-98.46475702
1893,13654,River Oaks,"868, Roberts Cut Off Road, River Oaks, Tarrant County, Texas, 76114, USA",32.77244058,-97.39935412
1894,13655,McKinney,"10586, Matador Drive, McKinney, Collin County, Texas, 75070, USA",33.18868038,-96.76143344
1895,13656,Port Aransas,"299, North Station Street, Port Aransas, Aransas County, Texas, 78373, USA",27.83336014,-97.05995703
1896,13657,Prosper,"Prairie Vista Drive, Crestview at Prosper, Prosper, Collin County, Texas, 75078, USA",33.24056239,-96.80014783
1897,13659,Austin,"2104, Kirksey Drive, Pleasant Valley, Austin, Travis County, Texas, 78741, USA",30.22980315,-97.71804924
1898,13660,Rockport,"Farm-to-Market Road 1781, Rockport, Aransas County, Texas, 78358, USA",28.09937074,-97.04855108
1899,13661,Houston,"3598, Clearview Circle, Houston, Harris County, Texas, 77054, USA",29.66774614,-95.433757
1900,13662,Corpus Christi,"Gully's Pub, 3039, Laguna Shores Road, Flour Bluff, Corpus Christi, Nueces County, Texas, 78418, USA",27.63115107,-97.28997268
1901,13663,Seabrook,"1801, Old Kirby Road, Taylor Lake Village, Harris County, Texas, 77586, USA",29.58624638,-95.05089053
1902,13664,Dallas,"2607, Lakeforest Court, Dallas, Dallas County, Texas, 75214, USA",32.8154442,-96.73267419
1903,13665,Denton,"North Bonnie Brae Street, Denton, Denton County, Texas, 76201, USA",33.22257982,-97.16197561
1904,13667,Corpus Christi,"14701, Whitecap Boulevard, Mustang-Padre Island, Corpus Christi, Nueces County, Texas, 78418, USA",27.60010538,-97.2159886
1905,13668,San Antonio,"290, Wayside Drive, San Antonio, Bexar County, Texas, 78213, USA",29.50153812,-98.53178105
1906,13669,Galveston,"Odyssey Academy Playground, 59th Street, Galveston, Galveston County, Texas, 77551, USA",29.27537545,-94.82895845
1907,13671,Houston,"16899, Parliament Drive, Mission Bend, Fort Bend County, Texas, 77083, USA",29.68488184,-95.67823221
1908,13672,Houston,"1110, West 22nd Street, North Inner Loop, Houston, Harris County, Texas, 77008, USA",29.80569878,-95.41846088
1909,13673,Dallas,"3930, Accent Drive, Dallas, Collin County, Texas, 75006:75287, USA",32.98837348,-96.84542102
1910,13674,Houston,"773, White Street, North Inner Loop, Houston, Harris County, Texas, 77007, USA",29.76596426,-95.37851235
1911,13675,Corpus Christi,"14114, East Cabana Street, Mustang-Padre Island, Corpus Christi, Nueces County, Texas, 78418, USA",27.62196441,-97.22452647
1912,13676,Corpus Christi,"Compass Street, Mustang-Padre Island, Corpus Christi, Nueces County, Texas, 78418, USA",27.61988469,-97.22384435
1913,13677,Corpus Christi,"14701, Whitecap Boulevard, Mustang-Padre Island, Corpus Christi, Nueces County, Texas, 78418, USA",27.60074848,-97.21571141
1914,13678,Katy,"3398, Thorpeshire Court, Parkland Place, Cinco Ranch, Fort Bend County, Texas, 77494, USA",29.73627603,-95.79216681
1915,13679,Corpus Christi,"15498, Gypsy Street, Mustang-Padre Island, Corpus Christi, Nueces County, Texas, 78418, USA",27.59942061,-97.22920882
1916,13680,Austin,"3011, Crownover Street, Chaparral Crossing, Hornsby Bend, Travis County, Texas, 78725, USA",30.2284023,-97.58926545
1917,13683,Houston,"1649, Neptune Lane, Houston, Harris County, Texas, 77062, USA",29.57272226,-95.11837874
1918,13685,Denton,"498, Coronado Drive, Denton, Denton County, Texas, 76209, USA",33.23917853,-97.12715207
1919,13686,Austin,"1300, Willow Street, East Cesar Chavez, Austin, Travis County, Texas, 78702, USA",30.2589935,-97.73159325
1920,13687,Haslet,"14069, Mallard Springs Drive, Avondale, Tarrant County, Texas, 76028, USA",32.98306917,-97.39978212
1921,13688,Dallas,"710, Dumas Street, Lower Greenville, Dallas, Dallas County, Texas, 75206, USA",32.80335948,-96.76349599
1922,13689,Pasadena,"Parkview Church of Christ, Patras Drive, Santorini, Pasadena, Harris County, Texas, 77505, USA",29.65224851,-95.13492071
1923,13690,Houston,"827, Saint Charles Street, Houston, Harris County, Texas, 77003, USA",29.75025653,-95.35083305
1924,13691,Angleton,"North Downing Street, Angleton, Brazoria County, Texas, 77515, USA",29.19680671,-95.41972222
1925,13692,Dallas,"507, North Oak Cliff Boulevard, Dallas, Dallas County, Texas, 75208:75211, USA",32.74877981,-96.85334207
1926,13694,Cedar Creek,"Utley, Bastrop County, Texas, USA",30.18539741,-97.4392211
1927,13695,Dallas,"906, Allen Street, West End Historic District, Dallas, Dallas County, Texas, 75204, USA",32.79173577,-96.78997731
1928,13696,Fort Worth,"7400, San Isabel Court, Fort Worth, Tarrant County, Texas, 76137, USA",32.87366745,-97.27278984
1929,13697,Houston,"Space Center Boulevard, Houston, Harris County, Texas, 77058, USA",29.58904648,-95.13487099
1930,13698,Galveston,"1479, Avenue K, Galveston, Galveston County, Texas, 77550, USA",29.30133424,-94.78211137
1931,13699,Canton,"Old Mill Marketplace, East Dallas Street, Canton, Van Zandt County, Texas, 75103, USA",32.55472667,-95.85331483
1932,13700,Houston,"Westpark Tollway, Houston, Harris County, Texas, TX 77057, USA",29.72416407,-95.47826981
1933,13701,Houston,"John W Anderson House, 711, Columbia Street, North Inner Loop, Houston, Harris County, Texas, 77008, USA",29.78461182,-95.39333445
1934,13703,Corpus Christi,"15018, Aruba Drive, Mustang-Padre Island, Corpus Christi, Nueces County, Texas, 78418, USA",27.60571994,-97.21221018
1935,13704,Lewisville,"1160, Wake Forest Drive, Lewisville, Denton County, Texas, 75077, USA",33.05885167,-97.02841468
1936,13705,Denton,"1029, Sierra Drive, Denton, Denton County, Texas, 76209, USA",33.24779702,-97.11713998
1937,13706,Port Aransas,"9th Street, Port Aransas, Aransas County, Texas, 78373, USA",27.83164741,-97.06325757
1938,13707,Denton,"414, Mimosa Drive, Denton, Denton County, Texas, 76201, USA",33.23901662,-97.13443633
1939,13708,Friendswood,"4616, Lundsford Hollow Lane, Harris County, Texas, 77546, USA",29.53816463,-95.17317561
1940,13709,Rogers,"12431, Reeds Lake Loop, Academy, Bell County, Texas, 76569, USA",30.9665972,-97.31752936
1941,13710,Killeen,"East Elms Road, Killeen, Bell County, Texas, 76542, USA",31.07609483,-97.7209201
1942,13711,League City,"63, Signature Point Drive, League City, Galveston County, Texas, 77573, USA",29.53335991,-95.07278642
1943,13712,Corpus Christi,"14833, Windward Drive, Mustang-Padre Island, Corpus Christi, Nueces County, Texas, 78418, USA",27.60742383,-97.20883855
1944,13713,Dallas,"714, Liberty Street, Dallas, Dallas County, Texas, 75204, USA",32.79061363,-96.7877669
1945,13714,Baytown,"7401, Ulysses Lane, Baytown, Harris County, Texas, 77521, USA",29.810019,-94.97946606
1946,13715,Dallas,"3440, Rosemeade Parkway, Dallas, Denton County, Texas, 75187, USA",33.01005899,-96.85979929
1947,13716,Corpus Christi,"14535, Verdemar Drive, Mustang-Padre Island, Corpus Christi, Nueces County, Texas, 78418, USA",27.62307067,-97.22070232
1948,13717,Richmond,"21069, Garden Arbor Lane, Lakemont Cove, Cinco Ranch, Fort Bend County, Texas, 77407, USA",29.70044285,-95.74710971
1949,13718,Fort Worth,"Belle Place, Fort Worth, Tarrant County, Texas, 76107, USA",32.73796996,-97.37676526
1950,13719,Allen,"823, Water Oak Drive, Allen, Collin County, Texas, 75002, USA",33.08334958,-96.62303125
1951,13720,Houston,"3139, Cline Street, Houston, Harris County, Texas, 77020, USA",29.76697276,-95.33806569
1952,13722,Allen,"755, Big Bend Drive, Allen, Collin County, Texas, 75002, USA",33.08590613,-96.6339783
1953,13723,Rockport,"600, East Hackberry Street, Rockport, Aransas County, Texas, 78382, USA",28.01749826,-97.05705672
1954,13724,Frisco,"2427, Brazos Drive, Frisco, Denton County, Texas, 75033, USA",33.18108853,-96.86794486
1955,13727,Dallas,"Preston Road, Dallas, Dallas County, Texas, 75248, USA",32.96259624,-96.80540363
1956,13729,Houston,"14613, Cobre Valley Drive, Houston, Harris County, Texas, 77062, USA",29.58400686,-95.13627622
1957,13730,Dallas,"3777, Royal Cove Drive, Dallas, Dallas County, Texas, 75229, USA",32.89447932,-96.85326031
1958,13731,Austin,"7236, Wardman Drive, Stoney Ridge, Moores Crossing, Travis County, Texas, 78617, USA",30.15504009,-97.64708643
1959,13732,Denton,"Linden Drive, Denton, Denton County, Texas, 76201, USA",33.22370399,-97.1551938
1960,13733,Paige,"Yewpon, Bastrop County, Texas, 78659, USA",30.17008728,-97.21629263
